User,Date Created,Tweets
Stevelee987,2023-02-28 23:58:45+00:00,@AppleSupport any tips to stop my iPhone 13 Pro from trying to go into macro mode on the telephoto camera? It just won’t focus and drives me insane 😡 https://t.co/B6o2ebAnC8
AppleSupport,2023-02-28 23:57:11+00:00,@tejbirbedi Thanks for tagging us! We’d be happy to assist with your Mac today. Send us a DM to get started. https://t.co/GDrqU22YpT
AppleSupport,2023-02-28 23:51:56+00:00,"@TheJShield We can help look into this with you. To help us get a better understanding, let us know in DM which device you have the Beats paired with. We’ll meet you there. https://t.co/GDrqU22YpT"
theITrebel,2023-02-28 23:48:47+00:00,@samuel_clements @JonesyChris This is exactly what I’m seeing with using 8.8.8.8 and no VPN. Clearly it’s a problem for many that @AppleSupport needs to fix. https://t.co/eD8rEYmkdh
AppleSupport,2023-02-28 23:45:55+00:00,@Mikeperezc We can help look into what’s happening with your iPhone. Send us a DM. We’ll meet you there to gather more details. https://t.co/GDrqU22YpT
TheJShield,2023-02-28 23:43:57+00:00,"There is nothing more annoying than the static white noise in my right @beatsbydre Studio Bud whenever I turn on Noise Cancelling mode 

How can I fix this @AppleSupport?"
AppleSupport,2023-02-28 23:38:48+00:00,"@_ilas_aiban Thanks for reaching out! 

If there’s features you’d like to see added to iOS, we can recommend leaving feedback here: https://t.co/ap3ASkCfXe https://t.co/GDrqU22YpT"
AppleSupport,2023-02-28 23:36:25+00:00,@krysticoll We have received your DM and will continue from there.
A_olawale1,2023-02-28 23:34:11+00:00,"@MrRobiiin @AppleSupport Tell the person to log out/in of phones Apple ID. It will work, had similar issues previously.

By the way I need a slot also"
Mikeperezc,2023-02-28 23:34:09+00:00,@kunaldudhalkar @Apple @AppleSupport Have they fix it?? I got the same issue 🤬🤯 https://t.co/kdKVDofKyo
mora_hlc,2023-02-28 23:26:44+00:00,"@AppleSupport The apple support account is not allowing me to send DMs. My mac doesn't show an alert. I have to plug it in to turn it on once it shuts down, and it first shows the battery to be empty but after a while the battery symbol indicates 57%"
krysticoll,2023-02-28 23:24:37+00:00,"Hey @Apple @AppleSupport  , I have an apple 13 pro and was working perfectly until last night after the new update. Now I can’t open the camera to take videos or photos because the phone overheats and the camera/video won’t focus 😡."
AppleSupport,2023-02-28 23:24:02+00:00,"@beautysheis570 We want to help with your AirPods. Does this happen when you connect them to a different device? If so, try resetting them with the steps here: https://t.co/bHKySjdt6W 

Send us a DM, so we can work together on a solution. https://t.co/GDrqU22YpT"
AppleSupport,2023-02-28 23:23:39+00:00,"@Jpmillernerd We assure you we can provide some information on Find My issues. First, if you feel your Apple ID has been compromised, be sure to reset the password and follow this article - https://t.co/tBGVwonw83 Let us know in DM if you run into an issue. https://t.co/GDrqU23wfr"
beautysheis570,2023-02-28 23:13:04+00:00,@AppleSupport Both AirPods work but only one plays at a time. How can I resolve?
AppleSupport,2023-02-28 23:06:38+00:00,"@mora_hlc Got it. To continue narrowing this down, when you start your Mac back up again, does it show an alert similar to your Mac restarted because of a problem? Like this alert: https://t.co/7QIWlWAkIE 

Try to DM to let us know, and we’ll meet you there. https://t.co/GDrqU22YpT"
AppleSupport,2023-02-28 23:02:37+00:00,"@charliecange We’d like to understand more about the issue you mention. Please follow the link to DM us what exactly is wrong that is considered broken, and we’ll take a further look. https://t.co/GDrqU22YpT"
AppleSupport,2023-02-28 22:59:15+00:00,"@bmclyne Hi, thanks for reaching out to us about your Apple Watch. We are happy to look into this with you.  Does the issue persist after a standard restart of the device? While this is a simple step it may help with odd issues that come up. DM if the issue persists. https://t.co/GDrqU22YpT"
mora_hlc,2023-02-28 22:54:59+00:00,@AppleSupport I'm trying to send a DM but it is not letting me. I'm not using a specific app when this happens. The macbook is using macOS ventura 13.2.1
AppleSupport,2023-02-28 22:53:21+00:00,"@Mr_Fabo_ We want both your AirPods charging as expected and we’d like to help. Does the issue persist after a reset? https://t.co/bHKySjdt6W 

If so, DM us with which device you use with your AirPods and the software version it’s running. We’ll take a closer look: https://t.co/GDrqU22YpT"
AppleSupport,2023-02-28 22:40:43+00:00,"@dougbreezy315 That’s not the experience we wish for you to have with your iPhone. We’re happy to investigate further with you. To get started, meet us in DM and verify the specific iOS software installed according to Settings &gt; General &gt; About and the apps affected: https://t.co/GDrqU22YpT"
AdilHindistan,2023-02-28 22:33:39+00:00,"I own the stock and the car but I must say it, I am worried about @tesla A great product does not make a great company, you also need great customer service like @AppleSupport"
AppleSupport,2023-02-28 22:28:19+00:00,"@juuuknows We’ll do all we can to help. To help us get a better understanding, are the AirPods offline, or are they not appearing at all within Find My? Let us know in DM. https://t.co/GDrqU22YpT"
AppleSupport,2023-02-28 22:27:12+00:00,@Tall_Curves We’d love to help you figure this out. Follow the steps in https://t.co/Udf3mWoKiY to identify what you were charged for. Have more questions on those charges? Contact our team that can investigate further using the link at the bottom of that page.
AppleSupport,2023-02-28 22:21:49+00:00,"@monicadsan We can help with your iPhone. Do you already have the latest iOS and App Store updates installed? 

Please send us a Direct Message for more help: https://t.co/GDrqU22YpT"
hibrandonantony,2023-02-28 22:05:57+00:00,people can’t see me from my iphone 14 pro max. they only see “connecting” and i only see this shit. fix this crap. @AppleSupport https://t.co/BQKee8XC9C
hibrandonantony,2023-02-28 22:01:51+00:00,i just want to disable the shit all together and regain a pleasant user experience. @AppleSupport
hibrandonantony,2023-02-28 22:01:51+00:00,"if a call drops, i have to wait anywhere between 1-30+ minutes to call the person back because my devices will still think i’m on an active call. 

if i actually try to shareplay, it’s roughly a 20% chance of it working as expected. @AppleSupport"
hibrandonantony,2023-02-28 22:01:50+00:00,"hey, @AppleSupport. i’d very much appreciate the option to disable shareplay.

since it’s debut, it has made the facetime experience so poor and makes something as simple as watching tv a pain. i can’t do anything without it asking if i want to shareplay."
AppleSupport,2023-02-28 21:59:10+00:00,"@MikeDavidCool We do’t like to hear that your AirPods are missing. Steps that can help you locate them can be found on this article: https://t.co/BzrpmBKUhQ If you need further help, let us know in DM and we’ll do what we can. https://t.co/GDrqU22YpT"
AppleSupport,2023-02-28 21:52:01+00:00,"@KevinTh40948839 We’d like to take a further look into this. Check iCloud from a browser and let us know if the contacts appear in iCloud, and you can DM us your answer here: https://t.co/GDrqU22YpT"
AppleSupport,2023-02-28 21:48:17+00:00,@pricflair We want to help as much as possible. Send us a DM  so we can work together on a solution. https://t.co/GDrqU22YpT
AppleSupport,2023-02-28 21:47:16+00:00,"@amarkum68044062 Hey, we see you would like a specific feature. We can point you in the right direction. If that’s something you would like to see in the future, please provide feedback using the following link: https://t.co/eTPVYVFyd8"
ONELONEDOLPHIN,2023-02-28 21:45:06+00:00,"@AppleSupport there’s an egregious problem/w @alaskausafcu ‘s app choosing to target #disabled members w/unrealistic demands that we TEXT during login

THIS VIOLATES #ADAlaw 

SEVERAL months ago AKUSAFCU was ASKED to create a way we can #OptOut  

WHY hasn’t it been fixed by now? https://t.co/hcRbiejVEm"
amarkum68044062,2023-02-28 21:43:25+00:00,@AppleSupport hello dear sir/madam i have a great change  for new updation in iphone desingn i know it is weard but guve a chance to explain the change or give email so that i can share that thing with them it’s humble request
AppleSupport,2023-02-28 21:40:30+00:00,@spawnsteryvr Thanks for reaching out to us. We'd like to help you and look into this further. Please DM us what iPhone model are you using and which iOS version it is running to continue working on this. https://t.co/GDrqU22YpT
Altavistagoogle,2023-02-28 21:33:22+00:00,@TheJohnWilliams @AppleSupport Probably related. Seems to work now.
spawnsteryvr,2023-02-28 21:32:33+00:00,@AppleSupport How can I book an appointment online for Genius Bar?  Going around in circles on your website without getting where I want to go.  Used to be very easy to do this.  Now not so much. 2/2
shouldhateu,2023-02-28 21:32:24+00:00,@AppleSupport thanks so much🙏🏼🙏🏼
AppleSupport,2023-02-28 21:30:38+00:00,"@wilIyoucry Hey there! We’re happy to help with your AirPods. Try the troubleshooting steps listed in this support article: https://t.co/mVd37zPp6r 

Then meet us in DM with the results using the link below. https://t.co/GDrqU22YpT"
spawnsteryvr,2023-02-28 21:30:06+00:00,@AppleSupport anytime I pug in my EarPods or AirPods this pops up.  These songs are no longer on my phone and no matter what I do I can’t stop this from appearing.  How do I get it to stop? 1/2 https://t.co/vDHOotJwgO
svenasol,2023-02-28 21:27:32+00:00,@PatrickHeneise @AppleSupport Oh my.... That's pretty horrible.
TheJohnWilliams,2023-02-28 21:25:20+00:00,"@Altavistagoogle @AppleSupport I was able to get 1 game to play, but it isn't 3 hours long video. Instead it was only 90 mins showing only the game. I suspect the links in the app are linking to a video (game day broadcast) that doesn't exist anymore as they probably should've been replaced by game only video https://t.co/GRuFkUaDF5"
AbdulSa41217987,2023-02-28 21:23:02+00:00,"@AppleSupport Apple wallet is thief, stolen my $3000 , apple wallet is the biggest fraudulent app in the human history"
TheJohnWilliams,2023-02-28 21:21:31+00:00,"@Altavistagoogle @AppleSupport I have a season pass subscription. I suspect there's a problem on the backend since all other videos except full game replays work on the platform. If I had to guess, the link to the full game replays are bad. It looks like it's not the full broadcast that was shown on game days"
KleoMusicUK,2023-02-28 21:19:58+00:00,@AppleSupport Thanks very much. I've checked out your reply 😀
racsiv27,2023-02-28 21:16:50+00:00,@AppleSupport anyone else iPhone not charge last night?
AppleSupport,2023-02-28 21:14:51+00:00,"@bwaybaby91 We’re here to help! To help isolate the behavior, can you test to see if the MagSafe charger works with a different device? Let us know in DM to continue. https://t.co/GDrqU22YpT"
AppleSupport,2023-02-28 21:12:06+00:00,"@KleoMusicUK Absolutely! We received your DM, look for our reply there."
AppleSupport,2023-02-28 21:10:21+00:00,"@PatrickHeneise We want to help with Photos. Make sure you have covered the steps in this resource which is geared towards your issue: https://t.co/74DrctGkaK 

Send us a DM if you still need help, so we can work together on a solution. https://t.co/GDrqU22YpT"
AppleSupport,2023-02-28 21:07:21+00:00,"@MohaHumud We know that battery life is important, and we’d be happy to help. DM us and let us know if you’re referring to the iPhone 14 or the iPhone 13 that is having the issue. Please include which version of software you’re using as well. https://t.co/GDrqU22YpT"
MrRobiiin,2023-02-28 21:05:26+00:00,@AppleSupport Waiting for you there :)
KleoMusicUK,2023-02-28 21:03:19+00:00,"@AppleSupport Hi there,

I've just sent you a DM.

Thanks,
Kleocharis"
PatrickHeneise,2023-02-28 21:02:12+00:00,Seems like Photos App deleted my entire shared library. 14k photos. Nothing to be found in deleted items. No recovery options either 😱 @AppleSupport
AppleSupport,2023-02-28 21:02:05+00:00,"@Refone10 We’d like to help look into this. To help us get a better understanding, let us know in DM exactly what you’re seeing on the iPhone screen. For example, is the iPhone disabled, or something else? https://t.co/GDrqU22YpT"
AppleSupport,2023-02-28 21:00:05+00:00,"@seriqiqi We’re happy to investigate this concern with you. On which device are you using Markup, in which app, and on what type of file? Does this affect all files or only specific ones? Let us know in DM to continue: https://t.co/GDrqU22YpT"
MohaHumud,2023-02-28 20:59:42+00:00,"@AppleSupport Hi, I recently purchased an iPhone 14 pro max through apple store - less than a month. What is unusual and i had an iPhone 13 pro max is that battery already started degrading and I am feeling disappointed. I had it shipped to Saudi Arabia so"
AppleSupport,2023-02-28 20:56:57+00:00,"@god_munky We’d like to help. You are able to activate the screen saver immediately on your Apple TV and enjoy our spectacular screen savers whenever you’d like. Learn how to do that here: https://t.co/rcml0jQIMD For more help, meet us in DM. https://t.co/GDrqU22YpT"
AppleSupport,2023-02-28 20:50:57+00:00,"@mora_hlc We’d like to learn more about this issue you’re having with your new MacBook Air. Are you using a specific app when this occurs? Send us a DM with your macOS version, and we’ll look into this together. https://t.co/GDrqU22YpT"
AppleSupport,2023-02-28 20:50:04+00:00,"@nxlle0 We’re confident we can help! 

Have you checked both your device and iCloud storage? The following page may help: 

DM us with questions or if you need further assistance. https://t.co/GDrqU22YpT"
kcrusher,2023-02-28 20:50:00+00:00,"@AppleSupport Can you or can you not create a bootable installer on an M1 Mac? Should be simple enough to answer and provide instructions. I'm at a loss here - there are hundreds of posts about this issue, yet no resolution, even on Apple forums. Quick deploys are critical for IT."
techiesaarthak,2023-02-28 20:47:58+00:00,"The only regret i have after switching to iPhone is lack of tap to pay feature (in india).
Come on apple, its high time now!
@Apple @tim_cook @AppleSupport"
AppleSupport,2023-02-28 20:47:56+00:00,@KBittermanGross You’re welcome! We have received your DM and will respond to you there.
kcrusher,2023-02-28 20:46:32+00:00,"@AppleSupport Whatever happened to accountability? When I worked at Avid, if you took the call, you took the case and saw it all the way through. You couldn't pass the buck without also being held accountable for it's resolution."
AppleSupport,2023-02-28 20:44:26+00:00,"@x3er We’d like to learn more about this issue you’re having with Freeform. What happens when you try to share a new document? Are you receiving any specific error messages? Send us a DM, and we’ll look into this together. https://t.co/GDrqU22YpT"
god_munky,2023-02-28 20:42:13+00:00,@AppleSupport @tim_cook AppleTv has some of the most beautiful screen savers I have ever seen any way to port them over to my Mac or just watch them at my leisure? @AppleTV
mora_hlc,2023-02-28 20:41:46+00:00,"@AppleSupport Just bought an Macbook air 2020 and it has shut down 2 times like it has run out of battery but when I plug it, the battery appears to be at 57%"
KBittermanGross,2023-02-28 20:39:44+00:00,@AppleSupport Thanks
AppleSupport,2023-02-28 20:35:10+00:00,"@MrRobiiin We’d like to take a further look into this, and help find the solution. Please DM us what message they see when attempting to view Apple Music, and we’ll get started there. https://t.co/GDrqU22YpT"
AppleSupport,2023-02-28 20:32:25+00:00,"@Guenter_AfD In this case, you’ll want to select the appropriate device and provide the feedback there. Here’s a quick link to the iPhone feedback page: https://t.co/O0Ad5McAEB 

If you’d like to discuss this further, send us a DM. We’ll take it from there. https://t.co/GDrqU22YpT"
King_Cole91,2023-02-28 20:32:18+00:00,@AppleSupport are terrible it’s so ridiculous that they don’t help with recovery key these thieving people just want you to spend money and your time on going back and forth by saying without the recovery key they can’t help even android is better than them
King_Cole91,2023-02-28 20:31:23+00:00,@Apple @AppleSupport are terrible it’s so ridiculous that they don’t help with recovery key these thieving people just want you to spend money and your time on going back and forth by saying without the recovery key they can’t help even android is better than them
x3er,2023-02-28 20:29:20+00:00,@AppleSupport why is Freeform not listed on this page? Sharing of new documents is down for me (existing shares still work). https://t.co/pa6CcmivIb
AppleSupport,2023-02-28 20:23:47+00:00,"@DrTigger We appreciate you reaching out to us about this, and we’d be happy to see how we can help. Please meet us in DM and we’ll continue working from there. https://t.co/GDrqU22YpT"
AppleSupport,2023-02-28 20:21:09+00:00,"@onikamine We want to ensure that you can enjoy your new iPhone so let’s look into this together to see what’s going on. Please join us in Direct Message and let us know what iOS version is installed as well as more details about what’s up. This way, we can best provide help. https://t.co/GDrqU22YpT"
AppleSupport,2023-02-28 20:21:02+00:00,"@MazidulZaman We’d like to learn more about your issue. Does this issue with the keyboard only occur on this website? Which app are you using? Send us a DM, and we’ll look into this together. https://t.co/GDrqU22YpT"
MrRobiiin,2023-02-28 20:18:17+00:00,@AppleSupport I added a new member to my apple one “ family “. We can’t make him access to my Apple Music subscription .. is there a delay ? We already followed the Apple Support website’s process #Help
AppleSupport,2023-02-28 20:18:17+00:00,"@MissLagostin Hi there. We’ll be glad to help you out with Apple Music. To start, let us know what happens when you try to use the service. Let us know in a DM and we’ll help further from there: https://t.co/GDrqU22YpT"
Guenter_AfD,2023-02-28 20:17:23+00:00,@AppleSupport But I can't find any remotely useful information about my problem
AppleSupport,2023-02-28 20:15:24+00:00,"@Sean_M_Allen Allow us to help out. It could be a phishing attempt. We’d recommend using the following for help with identifying these attempts: https://t.co/U9IFKYxXFa 

Have additional questions? Send us a DM. https://t.co/GDrqU22YpT"
AppleSupport,2023-02-28 20:14:23+00:00,"@KBittermanGross If you’re looking for assistance, we’re here for you! While we may need to focus our attention on a single issue at a time, we’re happy to assist with any and all concerns you may have. 

Let us know what you need help with in DM, we’ll work together from there. https://t.co/GDrqU22YpT"
DrTigger,2023-02-28 20:09:39+00:00,"@AppleSupport So why are the claims of apps constantly refreshing, Twitter, Truth, Safari, and Apple apps &amp; others not being addressed. Plenty of complaints on Apple support. It all started with iOS 16"
MazidulZaman,2023-02-28 20:09:29+00:00,"@Apple @AppleSupport what is going, now, how can I type anything? I need to replace this iPhone. #iPhone #iphone12 https://t.co/5WcYKy8elL"
AppleSupport,2023-02-28 20:07:38+00:00,"@Guenter_AfD We’re here to help. While some controls can be rearranged in the Control Center, this is not supported for the display brightness: https://t.co/pUMiioGuj6 

Feel free to share feedback here: https://t.co/eTPVYVFyd8"
AppleSupport,2023-02-28 20:03:16+00:00,"@ShahabZargari We understand the importance of opening your files. We’ll help however we can. Check out the information provided at https://t.co/o2OyuZLwEa If you’ve confirmed the file type is compatible with QuickTime and isn’t working, let us know in DM. https://t.co/GDrqU22YpT"
borjacajal,2023-02-28 19:57:26+00:00,There you go. So you can see #apple @Apple @AppleSupport @9to5mac @zollotech #bug #macos #ventura https://t.co/kdE2T5yobn
borjacajal,2023-02-28 19:56:23+00:00,"(2/2) I’m the #1 in the world to notice this bug.
#Apple #bug #macOS #Ventura @Apple @AppleSupport @zollotech @9to5mac #macbookpro #m2pro #applesilicon"
onikamine,2023-02-28 19:56:14+00:00,"Brand new iPhone 14 pro 
Notification bar is shaky 
Screen is shaky when rebooted 
Ear speaker sometimes sounds like a box 
Video is delayed before even recording ! 
What’s going on ?????? 
#apple #iphone #help #software @Apple @AppleSupport"
KBittermanGross,2023-02-28 19:55:33+00:00,@AppleSupport Apple default support page does no allow cross-device requests.
borjacajal,2023-02-28 19:54:43+00:00,@Apple @AppleSupport #Apple has a software bug on macOS Ventura 13.2.1. The battery indicator has a black dot on it. Apple sent me 3 different MacBook Pros 14 inch without them knowing what the problem was. After taking a screenshot I knew it was a software bug. Seems like (1/2)
Guenter_AfD,2023-02-28 19:54:38+00:00,"@AppleSupport Hello, I wanted to ask how I can bring the brightness setting and the volume setting to the other side, i.e. from left to right https://t.co/xyM91rHNvI"
siteexperts,2023-02-28 19:53:21+00:00,@BMWUSA @sprinkles19025 @BMW @BMWGroup @Apple @AppleSupport Any update.  Just got the car.  This is a huge safety issue as when the map goes haywire it draws your attention  as you attempt to figure out where you are and what is going on - especially as it keeps voicing  bad directions.   Want to send the car back.
Rahul18876252,2023-02-28 19:44:56+00:00,"@startrack @Apple @AppleSupport 
When @startrack will pickup my return order from Plumpton Marketplace Newsagency so that I can get my refund quick?
Its been a week now no action is taken from your end!!!"
AppleSupport,2023-02-28 19:41:06+00:00,@Tamarastampone You’re most welcome!
RedSlingerNYC,2023-02-28 19:39:16+00:00,"@AppleSupport aren't all websites/apps that use #SignUpWithApple supposed to have a ""Log in with Apple"" option too? @MyFitnessPal seems to have missed the memo on their website."
weirdviir,2023-02-28 19:34:54+00:00,"Hey @Apple, extremely disappointed with your service in India! Been trying to get my phone fixed for weeks but no luck. And to top it off, my warranty is ending today! What gives? 
@AppleSupport"
Altavistagoogle,2023-02-28 19:34:50+00:00,@TheJohnWilliams @AppleSupport Working again on Apple TV HD.
AppleSupport,2023-02-28 19:34:35+00:00,@Tamarastampone Great! Please feel free to reach out to us again if you need any more help. We’re available every day to answer your questions from 5 a.m.-8 p.m. Pacific. Have a great day!
Altavistagoogle,2023-02-28 19:33:17+00:00,@TheJohnWilliams @AppleSupport I got an error message on the web but it is actually working there once you tap OK. https://t.co/HcRkYXrh8F
AppleSupport,2023-02-28 19:29:20+00:00,@shankfrank We’d like to help and learn more. Please DM us if restarting your iPhone helps to hear through the receiver. This information will help us determine the next step on how to proceed. https://t.co/GDrqU22YpT
SidMercutio,2023-03-01 23:59:56+00:00,@itsdeepak_sr @AppleSupport @Apple kindly?...who? lol
Josealbertoxo,2023-03-01 23:59:14+00:00,"I demand an emoji from each planet what happens to you, we are in 2013 or that @AppleSupport"
AppleSupport,2023-03-01 23:56:38+00:00,@I_am_AVi_Ma Hello again! We’d like to continue to assist with these issues that you are experiencing. Join us back in DM and we’ll work with you there. https://t.co/GDrqU22YpT
parksachusetts,2023-03-01 23:55:58+00:00,"Thanks for the prompt reply @AppleSupport, but that seems silly. Many, many parents I know purchase an #AppleWatch for their kids to keep in contact during school weeks, but we end up getting recycled numbers and loads of junk texts. Seems like an easy fix to implement."
AppleSupport,2023-03-01 23:52:48+00:00,"@parksachusetts We’re here to help. While this isn’t supported on Apple Watch, we value your feedback. To ensure it reaches the appropriate team, share your thoughts here: https://t.co/eTPVYVFyd8"
WhiteChinese33,2023-03-01 23:51:34+00:00,@AppleSupport I was wondering if I'm the only one having issues with Apple Maps especially with CarPlay. After I use Siri with the address the map pops up for half a second and then disappears until you hit the map app again #AppleMaps
AppleSupport,2023-03-01 23:50:52+00:00,@timmer357 Hi there. We are happy to help. Can you please reply to us in DM with your device’s model and exact software version? This will help us determine how to proceed. Also this article has helpful tips if Siri is not working properly: https://t.co/tblCftNshf https://t.co/GDrqU22YpT
parksachusetts,2023-03-01 23:46:54+00:00,"Hey @Apple @AppleSupport - how come I can ‘Delete and report junk’ messages only my iPhone? My kids each have an #AppleWatch and get spam texts, but I can only delete - not mark as junk?"
timmer357,2023-03-01 23:40:55+00:00,@AppleSupport  Siri via car play is essentially unusual since last update. In all three of my cars so it’s not the vehicle. I have to say huge continuous sentences so it doesn’t stop and get its wrong 100% of the time. Garbage
AStopthemadness,2023-03-01 23:38:39+00:00,@johnrich My phone started dying everyday after this ridiculous update. This should be optional and not turned on by default. I turned it off and like magic my phone charges when I need it to not when and if the sun shines or the wind blows. @AppleSupport
